"id","name","slug","description","image","width","height","price","stock","createdAt","updatedAt"
99901,"Starry Night","starry-night","Limited edition print: a starry night skyline.","https://info.kinorevuen.dk/wp-content/uploads/2025/12/starry-night.jpg",50,70,49.99,10,"2025-12-12 09:00:00","2025-12-12 09:00:00"
99902,"Sunset Boulevard","sunset-boulevard","Vintage Hollywood poster, slightly faded colors.","https://info.kinorevuen.dk/wp-content/uploads/2025/12/sunset-boulevard.jpg",60,90,79.50,5,"2025-12-12 09:00:00","2025-12-12 09:00:00"
99903,"Classic Noir","classic-noir","Monochrome film noir poster with bold typography.","https://info.kinorevuen.dk/wp-content/uploads/2025/12/classic-noir.jpg",62,85,59.00,8,"2025-12-12 09:00:00","2025-12-12 09:00:00"
99904,"Space Odyssey","space-odyssey","Sci-fi épic poster with retro colors and stars.","https://info.kinorevuen.dk/wp-content/uploads/2025/12/space-odyssey.jpg",70,100,99.99,3,"2025-12-12 09:00:00","2025-12-12 09:00:00"
99905,"Ocean's Embrace","oceans-embrace","Minimalist ocean waves poster with warm tones.","https://info.kinorevuen.dk/wp-content/uploads/2025/12/oceans-embrace.jpg",50,70,39.95,12,"2025-12-12 09:00:00","2025-12-12 09:00:00"
